{
  "dataset_id": "two-pair-pilot",
  "development_data": true,
  "expected_matrix": {
    "cases": [
      {
        "optimization": "O0",
        "sample_id": "sample_0001"
      },
      {
        "optimization": "O2",
        "sample_id": "sample_0001"
      },
      {
        "optimization": "O0",
        "sample_id": "sample_0002"
      },
      {
        "optimization": "O2",
        "sample_id": "sample_0002"
      },
      {
        "optimization": "O0",
        "sample_id": "sample_0003"
      },
      {
        "optimization": "O2",
        "sample_id": "sample_0003"
      },
      {
        "optimization": "O0",
        "sample_id": "sample_0004"
      },
      {
        "optimization": "O2",
        "sample_id": "sample_0004"
      }
    ],
    "conditions": [
      "retained",
      "stripped"
    ]
  },
  "observations": [
    {
      "condition": "retained",
      "cwe": "CWE-121",
      "ground_truth": "vulnerable",
      "observation_id": "retained:sample_0001:O0",
      "optimization": "O0",
      "pair_id": "pair_0001",
      "record_path": "../../ghidra/output/retained/sample_0001_O0.json",
      "record_sha256": "997cdc43fd6c1f59e6359196b1c1f67bac1aaf8d04f3b5f8209691742eec37a4",
      "sample_id": "sample_0001"
    },
    {
      "condition": "retained",
      "cwe": "CWE-121",
      "ground_truth": "vulnerable",
      "observation_id": "retained:sample_0001:O2",
      "optimization": "O2",
      "pair_id": "pair_0001",
      "record_path": "../../ghidra/output/retained/sample_0001_O2.json",
      "record_sha256": "d6d1ffc89a3f1b4a99eaadabd21515b70abbd9f66fcd5849b56bfbe93b72bef0",
      "sample_id": "sample_0001"
    },
    {
      "condition": "retained",
      "cwe": "CWE-121",
      "ground_truth": "not_vulnerable",
      "observation_id": "retained:sample_0002:O0",
      "optimization": "O0",
      "pair_id": "pair_0001",
      "record_path": "../../ghidra/output/retained/sample_0002_O0.json",
      "record_sha256": "cee0274ea33bf8a1209db17239a691a965a3b527ad0cf7a48ecb4be812692f09",
      "sample_id": "sample_0002"
    },
    {
      "condition": "retained",
      "cwe": "CWE-121",
      "ground_truth": "not_vulnerable",
      "observation_id": "retained:sample_0002:O2",
      "optimization": "O2",
      "pair_id": "pair_0001",
      "record_path": "../../ghidra/output/retained/sample_0002_O2.json",
      "record_sha256": "ca341d5a70bff3a98b2c9a1638d83c30e0080c83eeeaa60c10e9a73db0744b17",
      "sample_id": "sample_0002"
    },
    {
      "condition": "retained",
      "cwe": "CWE-122",
      "ground_truth": "vulnerable",
      "observation_id": "retained:sample_0003:O0",
      "optimization": "O0",
      "pair_id": "pair_0002",
      "record_path": "../../ghidra/output/retained/sample_0003_O0.json",
      "record_sha256": "6aaaa25f81a4d207e96bbfe1bc12aec6c04fe6894ef137a5f3e9cd84b226fdbe",
      "sample_id": "sample_0003"
    },
    {
      "condition": "retained",
      "cwe": "CWE-122",
      "ground_truth": "vulnerable",
      "observation_id": "retained:sample_0003:O2",
      "optimization": "O2",
      "pair_id": "pair_0002",
      "record_path": "../../ghidra/output/retained/sample_0003_O2.json",
      "record_sha256": "e01fcaf4e88d48e9e44936535c4d79509fd9fa1f37cc372febe9145e55dff88a",
      "sample_id": "sample_0003"
    },
    {
      "condition": "retained",
      "cwe": "CWE-122",
      "ground_truth": "not_vulnerable",
      "observation_id": "retained:sample_0004:O0",
      "optimization": "O0",
      "pair_id": "pair_0002",
      "record_path": "../../ghidra/output/retained/sample_0004_O0.json",
      "record_sha256": "c39286c3e4b66b6dc53ae383012990de194ed5e8e51392fcaa42db25fbf7d6c9",
      "sample_id": "sample_0004"
    },
    {
      "condition": "retained",
      "cwe": "CWE-122",
      "ground_truth": "not_vulnerable",
      "observation_id": "retained:sample_0004:O2",
      "optimization": "O2",
      "pair_id": "pair_0002",
      "record_path": "../../ghidra/output/retained/sample_0004_O2.json",
      "record_sha256": "4f828099ca2538b9a98b72e095649fed881f565fb11a2606e580c6851666fa4c",
      "sample_id": "sample_0004"
    },
    {
      "condition": "stripped",
      "cwe": "CWE-121",
      "ground_truth": "vulnerable",
      "observation_id": "stripped:sample_0001:O0",
      "optimization": "O0",
      "pair_id": "pair_0001",
      "record_path": "../../ghidra/output/stripped/sample_0001_O0.json",
      "record_sha256": "177c4753fd1397cfcc4a6f603c19a49f82bd1c0669eddf8fc4defb8bbbd0fa44",
      "sample_id": "sample_0001"
    },
    {
      "condition": "stripped",
      "cwe": "CWE-121",
      "ground_truth": "vulnerable",
      "observation_id": "stripped:sample_0001:O2",
      "optimization": "O2",
      "pair_id": "pair_0001",
      "record_path": "../../ghidra/output/stripped/sample_0001_O2.json",
      "record_sha256": "dcf063f899f8f768f1ead4d5e6d17edd1b52afaacc882976c9d63cc2253a3941",
      "sample_id": "sample_0001"
    },
    {
      "condition": "stripped",
      "cwe": "CWE-121",
      "ground_truth": "not_vulnerable",
      "observation_id": "stripped:sample_0002:O0",
      "optimization": "O0",
      "pair_id": "pair_0001",
      "record_path": "../../ghidra/output/stripped/sample_0002_O0.json",
      "record_sha256": "9bcde65df137c666bb2a3d3820a5091412bfc7f4139912a7d74de1baa739d0de",
      "sample_id": "sample_0002"
    },
    {
      "condition": "stripped",
      "cwe": "CWE-121",
      "ground_truth": "not_vulnerable",
      "observation_id": "stripped:sample_0002:O2",
      "optimization": "O2",
      "pair_id": "pair_0001",
      "record_path": "../../ghidra/output/stripped/sample_0002_O2.json",
      "record_sha256": "39b90320b436ad044ab60695fddbda8a11922bc40a42b6f93c50fccba7d7fd52",
      "sample_id": "sample_0002"
    },
    {
      "condition": "stripped",
      "cwe": "CWE-122",
      "ground_truth": "vulnerable",
      "observation_id": "stripped:sample_0003:O0",
      "optimization": "O0",
      "pair_id": "pair_0002",
      "record_path": "../../ghidra/output/stripped/sample_0003_O0.json",
      "record_sha256": "d9156910d274b42695a069662707269dbd05128e269a3448980a53299ca02cfa",
      "sample_id": "sample_0003"
    },
    {
      "condition": "stripped",
      "cwe": "CWE-122",
      "ground_truth": "vulnerable",
      "observation_id": "stripped:sample_0003:O2",
      "optimization": "O2",
      "pair_id": "pair_0002",
      "record_path": "../../ghidra/output/stripped/sample_0003_O2.json",
      "record_sha256": "797f217f8b5fe246129ad1756b5370ba0540e7be0864b5df174394ce021e6755",
      "sample_id": "sample_0003"
    },
    {
      "condition": "stripped",
      "cwe": "CWE-122",
      "ground_truth": "not_vulnerable",
      "observation_id": "stripped:sample_0004:O0",
      "optimization": "O0",
      "pair_id": "pair_0002",
      "record_path": "../../ghidra/output/stripped/sample_0004_O0.json",
      "record_sha256": "a4a439216b2cd257f9f60b7e6fecd0e90b4fd42f46c0bd6135b93b0e21ef9e4d",
      "sample_id": "sample_0004"
    },
    {
      "condition": "stripped",
      "cwe": "CWE-122",
      "ground_truth": "not_vulnerable",
      "observation_id": "stripped:sample_0004:O2",
      "optimization": "O2",
      "pair_id": "pair_0002",
      "record_path": "../../ghidra/output/stripped/sample_0004_O2.json",
      "record_sha256": "b16052b5f7af6772b56dd2caec4fd9f8b80882e4f9de25f3017bd9f077899a02",
      "sample_id": "sample_0004"
    }
  ],
  "schema_version": "1.0"
}
